{
  "version": 1,
  "defaultMode": "disabled",
  "policy": {
    "failClosed": true,
    "paidFallbackAllowed": false,
    "storesSecretsInBrowser": false,
    "storesSecretsInRepo": false,
    "requiresWrittenReleaseApproval": true
  },
  "providers": [
    {
      "id": "local-browser",
      "type": "webgpu",
      "costRisk": "zero-central-cost-risk",
      "enabledByDefault": true,
      "requiresUserDownload": true,
      "fallback": "disabled"
    },
    {
      "id": "byok-openai-compatible",
      "type": "byok",
      "costRisk": "user-owned",
      "enabledByDefault": true,
      "storesKeyOnServer": false,
      "fallback": "disabled"
    },
    {
      "id": "free-demo-hardlimit",
      "type": "server-demo",
      "costRisk": "zero-until-hard-stop",
      "enabledByDefault": false,
      "requiresServerQuota": true,
      "fallback": "disabled"
    },
    {
      "id": "kimi-k2-7-vault",
      "type": "model-vault",
      "costRisk": "storage-only",
      "enabledByDefault": false,
      "inference": "not-local-free",
      "fallback": "byok-openai-compatible"
    },
    {
      "id": "disabled",
      "type": "disabled",
      "costRisk": "zero",
      "enabledByDefault": true,
      "fallback": "disabled"
    },
    {
      "id": "later-partner-compute",
      "type": "future-compute",
      "costRisk": "requires-explicit-approval",
      "enabledByDefault": false,
      "disabledUntilApproved": true,
      "fallback": "disabled"
    }
  ]
}
